cesga/2020 unloaded
        Preparing the environment for use of the CESGA 2022 software stack.
        Please rebuild modules cache: module --ignore-cache avail
     
cesga/2022 loaded
python/3.10.8 loaded

The following have been reloaded with a version change:
  1) cesga/2020 => cesga/2022

[I 2024-07-04 07:01:21,409] A new study created in memory with name: no-name-dcc53043-1138-4d3b-b4ed-8602bfee97dc
[I 2024-07-04 07:37:32,165] Trial 0 finished with value: 0.94690965054896 and parameters: {'learning_rate': 0.0013292918943162175, 'embedding_dim': 16, 'depth': 4, 'heads': 2, 'attn_dropout': 0.05, 'ff_dropout': 0.05, 'use_shared_categ_embed': True, 'n_layers': 2, 'n_units_l0': 5, 'n_units_l1': 5, 'mlp_act': 'relu', 'batch_size': 512, 'imputer_strategy': 'mean', 'scaler': 'RobustScaler'}. Best is trial 0 with value: 0.94690965054896.
[I 2024-07-04 08:18:04,927] Trial 1 finished with value: 0.924282221183691 and parameters: {'learning_rate': 0.0019762189340280074, 'embedding_dim': 32, 'depth': 2, 'heads': 4, 'attn_dropout': 0.15000000000000002, 'ff_dropout': 0.25, 'use_shared_categ_embed': True, 'n_layers': 2, 'n_units_l0': 5, 'n_units_l1': 5, 'mlp_act': 'relu', 'batch_size': 256, 'imputer_strategy': 'mean', 'scaler': 'MinMaxScaler'}. Best is trial 0 with value: 0.94690965054896.
[I 2024-07-04 10:14:13,452] Trial 2 finished with value: 0.9316268054782352 and parameters: {'learning_rate': 0.0008200518402245837, 'embedding_dim': 32, 'depth': 4, 'heads': 2, 'attn_dropout': 0.25, 'ff_dropout': 0.05, 'use_shared_categ_embed': True, 'n_layers': 2, 'n_units_l0': 5, 'n_units_l1': 5, 'mlp_act': 'relu', 'batch_size': 128, 'imputer_strategy': 'most_frequent', 'scaler': 'MinMaxScaler'}. Best is trial 0 with value: 0.94690965054896.
[I 2024-07-04 10:35:44,462] Trial 3 finished with value: 0.9006988337987233 and parameters: {'learning_rate': 0.00621870472776908, 'embedding_dim': 16, 'depth': 2, 'heads': 2, 'attn_dropout': 0.15000000000000002, 'ff_dropout': 0.2, 'use_shared_categ_embed': False, 'n_layers': 2, 'n_units_l0': 5, 'n_units_l1': 5, 'mlp_act': 'relu', 'batch_size': 512, 'imputer_strategy': 'median', 'scaler': 'StandardScaler'}. Best is trial 0 with value: 0.94690965054896.
[I 2024-07-04 13:53:25,947] Trial 4 finished with value: 0.89265825100836 and parameters: {'learning_rate': 0.00010388823104027947, 'embedding_dim': 16, 'depth': 5, 'heads': 8, 'attn_dropout': 0.05, 'ff_dropout': 0.2, 'use_shared_categ_embed': False, 'n_layers': 2, 'n_units_l0': 5, 'n_units_l1': 5, 'mlp_act': 'relu', 'batch_size': 128, 'imputer_strategy': 'most_frequent', 'scaler': 'MinMaxScaler'}. Best is trial 0 with value: 0.94690965054896.
[I 2024-07-04 13:53:39,901] Trial 5 pruned. 
[I 2024-07-04 13:53:54,624] Trial 6 pruned. 
[I 2024-07-04 13:54:06,480] Trial 7 pruned. 
[I 2024-07-04 13:54:28,470] Trial 8 pruned. 
[I 2024-07-04 13:54:57,113] Trial 9 pruned. 
[I 2024-07-04 14:53:29,289] Trial 10 finished with value: 0.9615526261457823 and parameters: {'learning_rate': 0.0010548702714918063, 'embedding_dim': 32, 'depth': 6, 'heads': 4, 'attn_dropout': 0.35000000000000003, 'ff_dropout': 0.45, 'use_shared_categ_embed': True, 'n_layers': 2, 'n_units_l0': 5, 'n_units_l1': 5, 'mlp_act': 'relu', 'batch_size': 512, 'imputer_strategy': 'mean', 'scaler': 'RobustScaler'}. Best is trial 10 with value: 0.9615526261457823.
[I 2024-07-04 14:53:54,725] Trial 11 pruned. 
[I 2024-07-04 14:54:28,035] Trial 12 pruned. 
[I 2024-07-04 14:54:36,220] Trial 13 pruned. 
[I 2024-07-04 14:55:16,905] Trial 14 pruned. 
[I 2024-07-04 14:55:50,682] Trial 15 pruned. 
[I 2024-07-04 14:56:04,579] Trial 16 pruned. 
[I 2024-07-04 16:30:01,460] Trial 17 finished with value: 0.8876964296476126 and parameters: {'learning_rate': 0.003539166910822011, 'embedding_dim': 32, 'depth': 3, 'heads': 4, 'attn_dropout': 0.05, 'ff_dropout': 0.05, 'use_shared_categ_embed': True, 'n_layers': 2, 'n_units_l0': 5, 'n_units_l1': 5, 'mlp_act': 'relu', 'batch_size': 128, 'imputer_strategy': 'most_frequent', 'scaler': 'StandardScaler'}. Best is trial 10 with value: 0.9615526261457823.
[I 2024-07-04 16:30:49,138] Trial 18 pruned. 
[I 2024-07-04 16:31:41,353] Trial 19 pruned. 
[I 2024-07-04 16:32:03,834] Trial 20 pruned. 
[I 2024-07-04 16:32:18,143] Trial 21 pruned. 
[I 2024-07-04 16:33:05,161] Trial 22 pruned. 
[I 2024-07-04 16:58:39,990] Trial 23 finished with value: 0.9007079133037467 and parameters: {'learning_rate': 0.007861612553123303, 'embedding_dim': 16, 'depth': 3, 'heads': 6, 'attn_dropout': 0.35000000000000003, 'ff_dropout': 0.4, 'use_shared_categ_embed': True, 'n_layers': 2, 'n_units_l0': 5, 'n_units_l1': 5, 'mlp_act': 'relu', 'batch_size': 512, 'imputer_strategy': 'median', 'scaler': 'RobustScaler'}. Best is trial 10 with value: 0.9615526261457823.
[I 2024-07-04 17:00:03,034] Trial 24 pruned. 
[I 2024-07-04 17:00:18,764] Trial 25 pruned. 
[I 2024-07-04 17:00:47,519] Trial 26 pruned. 
[I 2024-07-04 17:01:17,283] Trial 27 pruned. 
[I 2024-07-04 17:03:09,420] Trial 28 pruned. 
[I 2024-07-04 17:03:48,082] Trial 29 pruned. 
[I 2024-07-04 17:04:02,645] Trial 30 pruned. 
[I 2024-07-04 17:05:33,684] Trial 31 pruned. 
[I 2024-07-04 17:06:06,516] Trial 32 pruned. 
[I 2024-07-04 17:06:15,538] Trial 33 pruned. 
[I 2024-07-04 17:55:03,928] Trial 34 finished with value: 0.9215460119869417 and parameters: {'learning_rate': 0.007650699925531632, 'embedding_dim': 32, 'depth': 6, 'heads': 2, 'attn_dropout': 0.15000000000000002, 'ff_dropout': 0.45, 'use_shared_categ_embed': True, 'n_layers': 2, 'n_units_l0': 5, 'n_units_l1': 5, 'mlp_act': 'relu', 'batch_size': 512, 'imputer_strategy': 'mean', 'scaler': 'StandardScaler'}. Best is trial 10 with value: 0.9615526261457823.
[I 2024-07-04 17:56:20,461] Trial 35 pruned. 
[I 2024-07-04 17:56:44,658] Trial 36 pruned. 
[I 2024-07-04 17:57:19,010] Trial 37 pruned. 
[I 2024-07-04 17:57:30,372] Trial 38 pruned. 
[I 2024-07-04 17:58:26,024] Trial 39 pruned. 
[I 2024-07-04 17:58:40,438] Trial 40 pruned. 
[I 2024-07-04 18:56:04,898] Trial 41 finished with value: 0.9504149879013317 and parameters: {'learning_rate': 0.0020768480625669885, 'embedding_dim': 32, 'depth': 3, 'heads': 6, 'attn_dropout': 0.25, 'ff_dropout': 0.15000000000000002, 'use_shared_categ_embed': True, 'n_layers': 2, 'n_units_l0': 5, 'n_units_l1': 5, 'mlp_act': 'relu', 'batch_size': 256, 'imputer_strategy': 'median', 'scaler': 'RobustScaler'}. Best is trial 10 with value: 0.9615526261457823.
[I 2024-07-04 19:39:14,254] Trial 42 finished with value: 0.9296511118927999 and parameters: {'learning_rate': 0.0072480013871475115, 'embedding_dim': 32, 'depth': 5, 'heads': 2, 'attn_dropout': 0.15000000000000002, 'ff_dropout': 0.15000000000000002, 'use_shared_categ_embed': True, 'n_layers': 2, 'n_units_l0': 5, 'n_units_l1': 5, 'mlp_act': 'relu', 'batch_size': 512, 'imputer_strategy': 'median', 'scaler': 'StandardScaler'}. Best is trial 10 with value: 0.9615526261457823.
[I 2024-07-04 19:39:29,827] Trial 43 pruned. 
[I 2024-07-04 19:39:45,755] Trial 44 pruned. 
[I 2024-07-04 19:40:15,151] Trial 45 pruned. 
[I 2024-07-04 19:40:27,120] Trial 46 pruned. 
[I 2024-07-04 19:40:39,052] Trial 47 pruned. 
[I 2024-07-04 19:41:04,945] Trial 48 pruned. 
[I 2024-07-04 19:41:33,347] Trial 49 pruned. 
[I 2024-07-04 19:41:56,249] Trial 50 pruned. 
[I 2024-07-04 19:43:05,422] Trial 51 pruned. 
[I 2024-07-04 19:43:17,720] Trial 52 pruned. 
[I 2024-07-04 19:45:26,743] Trial 53 pruned. 
[I 2024-07-04 19:46:38,534] Trial 54 pruned. 
[I 2024-07-04 19:47:23,898] Trial 55 pruned. 
[I 2024-07-04 19:47:53,641] Trial 56 pruned. 
[I 2024-07-04 19:48:09,697] Trial 57 pruned. 
[I 2024-07-04 19:48:23,481] Trial 58 pruned. 
[I 2024-07-04 19:49:08,753] Trial 59 pruned. 
