cesga/2020 unloaded
        Preparing the environment for use of the CESGA 2022 software stack.
        Please rebuild modules cache: module --ignore-cache avail
     
cesga/2022 loaded
python/3.10.8 loaded

The following have been reloaded with a version change:
  1) cesga/2020 => cesga/2022

[I 2024-07-05 13:34:50,551] A new study created in memory with name: no-name-0f428cf4-5712-4090-af7d-1f74b1519725
[I 2024-07-05 13:55:45,144] Trial 0 finished with value: 0.9420697868243512 and parameters: {'learning_rate': 0.0013292918943162175, 'embedding_dim': 16, 'depth': 4, 'heads': 2, 'attn_dropout': 0.05, 'ff_dropout': 0.05, 'use_shared_categ_embed': True, 'batch_size': 512, 'imputer_strategy': 'mean', 'scaler': 'RobustScaler'}. Best is trial 0 with value: 0.9420697868243512.
[I 2024-07-05 16:09:21,424] Trial 1 finished with value: 0.938975219318729 and parameters: {'learning_rate': 0.0019762189340280074, 'embedding_dim': 32, 'depth': 2, 'heads': 4, 'attn_dropout': 0.15000000000000002, 'ff_dropout': 0.25, 'use_shared_categ_embed': True, 'batch_size': 256, 'imputer_strategy': 'mean', 'scaler': 'MinMaxScaler'}. Best is trial 0 with value: 0.9420697868243512.
[I 2024-07-05 20:48:17,419] Trial 2 finished with value: 0.9398652653738658 and parameters: {'learning_rate': 0.0008200518402245837, 'embedding_dim': 32, 'depth': 4, 'heads': 2, 'attn_dropout': 0.25, 'ff_dropout': 0.05, 'use_shared_categ_embed': True, 'batch_size': 128, 'imputer_strategy': 'most_frequent', 'scaler': 'MinMaxScaler'}. Best is trial 0 with value: 0.9420697868243512.
[I 2024-07-05 21:07:11,205] Trial 3 finished with value: 0.9365594980636726 and parameters: {'learning_rate': 0.00621870472776908, 'embedding_dim': 16, 'depth': 2, 'heads': 2, 'attn_dropout': 0.15000000000000002, 'ff_dropout': 0.2, 'use_shared_categ_embed': False, 'batch_size': 512, 'imputer_strategy': 'median', 'scaler': 'StandardScaler'}. Best is trial 0 with value: 0.9420697868243512.
[I 2024-07-05 22:50:10,196] Trial 4 finished with value: 0.9416873711210583 and parameters: {'learning_rate': 0.00010388823104027947, 'embedding_dim': 16, 'depth': 5, 'heads': 8, 'attn_dropout': 0.05, 'ff_dropout': 0.2, 'use_shared_categ_embed': False, 'batch_size': 128, 'imputer_strategy': 'most_frequent', 'scaler': 'MinMaxScaler'}. Best is trial 0 with value: 0.9420697868243512.
[I 2024-07-05 22:50:31,173] Trial 5 pruned. 
[I 2024-07-05 22:54:48,485] Trial 6 pruned. 
[I 2024-07-05 22:54:56,192] Trial 7 pruned. 
[I 2024-07-05 22:55:57,307] Trial 8 pruned. 
[I 2024-07-05 22:56:27,262] Trial 9 pruned. 
[I 2024-07-05 22:56:48,328] Trial 10 pruned. 
[I 2024-07-05 22:57:06,965] Trial 11 pruned. 
[I 2024-07-05 22:57:53,989] Trial 12 pruned. 
[I 2024-07-05 23:19:22,625] Trial 13 finished with value: 0.9421112077079487 and parameters: {'learning_rate': 0.0003852378615162035, 'embedding_dim': 16, 'depth': 2, 'heads': 6, 'attn_dropout': 0.05, 'ff_dropout': 0.5, 'use_shared_categ_embed': True, 'batch_size': 512, 'imputer_strategy': 'median', 'scaler': 'StandardScaler'}. Best is trial 13 with value: 0.9421112077079487.
[I 2024-07-05 23:19:46,932] Trial 14 pruned. 
[I 2024-07-05 23:20:22,561] Trial 15 pruned. 
[I 2024-07-05 23:27:46,556] Trial 16 pruned. 
[I 2024-07-05 23:32:28,904] Trial 17 pruned. 
[I 2024-07-05 23:32:53,803] Trial 18 pruned. 
[I 2024-07-05 23:36:32,862] Trial 19 pruned. 
[I 2024-07-05 23:36:47,178] Trial 20 pruned. 
[I 2024-07-05 23:36:56,316] Trial 21 pruned. 
[I 2024-07-05 23:37:56,899] Trial 22 pruned. 
[I 2024-07-05 23:38:04,741] Trial 23 pruned. 
[I 2024-07-05 23:38:50,802] Trial 24 pruned. 
[I 2024-07-05 23:38:59,011] Trial 25 pruned. 
[I 2024-07-05 23:41:00,827] Trial 26 pruned. 
[I 2024-07-05 23:41:34,452] Trial 27 pruned. 
[I 2024-07-05 23:42:38,712] Trial 28 pruned. 
[I 2024-07-05 23:43:01,516] Trial 29 pruned. 
[I 2024-07-05 23:43:10,861] Trial 30 pruned. 
[I 2024-07-05 23:43:43,561] Trial 31 pruned. 
[I 2024-07-06 00:51:23,018] Trial 32 finished with value: 0.941178788771456 and parameters: {'learning_rate': 0.00027619794488595805, 'embedding_dim': 16, 'depth': 3, 'heads': 4, 'attn_dropout': 0.45, 'ff_dropout': 0.25, 'use_shared_categ_embed': False, 'batch_size': 128, 'imputer_strategy': 'median', 'scaler': 'StandardScaler'}. Best is trial 13 with value: 0.9421112077079487.
[I 2024-07-06 00:51:42,254] Trial 33 pruned. 
[I 2024-07-06 00:52:02,805] Trial 34 pruned. 
[I 2024-07-06 00:54:53,639] Trial 35 pruned. 
[I 2024-07-06 00:55:07,249] Trial 36 pruned. 
[I 2024-07-06 00:57:57,168] Trial 37 pruned. 
[I 2024-07-06 00:58:17,562] Trial 38 pruned. 
[I 2024-07-06 01:22:48,833] Trial 39 pruned. 
[I 2024-07-06 01:22:57,952] Trial 40 pruned. 
[I 2024-07-06 01:23:30,592] Trial 41 pruned. 
[I 2024-07-06 01:23:50,563] Trial 42 pruned. 
[I 2024-07-06 01:24:11,536] Trial 43 pruned. 
[I 2024-07-06 01:24:33,396] Trial 44 pruned. 
[I 2024-07-06 01:24:50,170] Trial 45 pruned. 
[I 2024-07-06 01:24:57,313] Trial 46 pruned. 
[I 2024-07-06 01:25:05,461] Trial 47 pruned. 
[I 2024-07-06 01:27:32,230] Trial 48 pruned. 
[I 2024-07-06 01:30:20,106] Trial 49 pruned. 
[I 2024-07-06 01:31:21,669] Trial 50 pruned. 
[I 2024-07-06 01:31:55,819] Trial 51 pruned. 
[I 2024-07-06 01:32:03,440] Trial 52 pruned. 
[I 2024-07-06 01:33:02,154] Trial 53 pruned. 
[I 2024-07-06 01:33:23,751] Trial 54 pruned. 
[I 2024-07-06 01:33:31,470] Trial 55 pruned. 
[I 2024-07-06 01:49:16,022] Trial 56 pruned. 
[I 2024-07-06 01:49:24,250] Trial 57 pruned. 
[I 2024-07-06 01:49:35,986] Trial 58 pruned. 
[I 2024-07-06 01:50:36,724] Trial 59 pruned. 
