cesga/2020 unloaded
        Preparing the environment for use of the CESGA 2022 software stack.
        Please rebuild modules cache: module --ignore-cache avail
     
cesga/2022 loaded
python/3.10.8 loaded

The following have been reloaded with a version change:
  1) cesga/2020 => cesga/2022

[I 2024-07-06 01:55:13,015] A new study created in memory with name: no-name-77f3d903-299d-439b-96c4-daf145db046c
[I 2024-07-06 03:18:03,995] Trial 0 finished with value: 0.9463793103448277 and parameters: {'learning_rate': 0.0013292918943162175, 'embedding_dim': 16, 'depth': 4, 'heads': 2, 'attn_dropout': 0.05, 'ff_dropout': 0.05, 'use_shared_categ_embed': True, 'batch_size': 512, 'imputer_strategy': 'mean', 'scaler': 'RobustScaler'}. Best is trial 0 with value: 0.9463793103448277.
[I 2024-07-06 09:22:59,438] Trial 1 finished with value: 0.6903017241379311 and parameters: {'learning_rate': 0.0019762189340280074, 'embedding_dim': 32, 'depth': 2, 'heads': 4, 'attn_dropout': 0.15000000000000002, 'ff_dropout': 0.25, 'use_shared_categ_embed': True, 'batch_size': 256, 'imputer_strategy': 'mean', 'scaler': 'MinMaxScaler'}. Best is trial 0 with value: 0.9463793103448277.
[I 2024-07-07 07:16:31,716] Trial 2 finished with value: 0.7750574712643679 and parameters: {'learning_rate': 0.0008200518402245837, 'embedding_dim': 32, 'depth': 4, 'heads': 2, 'attn_dropout': 0.25, 'ff_dropout': 0.05, 'use_shared_categ_embed': True, 'batch_size': 128, 'imputer_strategy': 'most_frequent', 'scaler': 'MinMaxScaler'}. Best is trial 0 with value: 0.9463793103448277.
[I 2024-07-07 08:35:30,668] Trial 3 finished with value: 0.28497126436781606 and parameters: {'learning_rate': 0.00621870472776908, 'embedding_dim': 16, 'depth': 2, 'heads': 2, 'attn_dropout': 0.15000000000000002, 'ff_dropout': 0.2, 'use_shared_categ_embed': False, 'batch_size': 512, 'imputer_strategy': 'median', 'scaler': 'StandardScaler'}. Best is trial 0 with value: 0.9463793103448277.
[I 2024-07-07 16:59:05,587] Trial 4 finished with value: 0.8828160919540229 and parameters: {'learning_rate': 0.00010388823104027947, 'embedding_dim': 16, 'depth': 5, 'heads': 8, 'attn_dropout': 0.05, 'ff_dropout': 0.2, 'use_shared_categ_embed': False, 'batch_size': 128, 'imputer_strategy': 'most_frequent', 'scaler': 'MinMaxScaler'}. Best is trial 0 with value: 0.9463793103448277.
[I 2024-07-07 17:00:48,016] Trial 5 pruned. 
[I 2024-07-07 17:03:39,231] Trial 6 pruned. 
[I 2024-07-07 17:03:59,744] Trial 7 pruned. 
[I 2024-07-08 01:44:07,448] Trial 8 finished with value: 0.9442385057471263 and parameters: {'learning_rate': 0.000715354779469316, 'embedding_dim': 32, 'depth': 4, 'heads': 2, 'attn_dropout': 0.15000000000000002, 'ff_dropout': 0.5, 'use_shared_categ_embed': True, 'batch_size': 256, 'imputer_strategy': 'median', 'scaler': 'StandardScaler'}. Best is trial 0 with value: 0.9463793103448277.
[I 2024-07-08 01:44:50,369] Trial 9 pruned. 
[I 2024-07-08 01:45:44,309] Trial 10 pruned. 
[I 2024-07-08 01:46:36,650] Trial 11 pruned. 
[I 2024-07-08 01:50:19,396] Trial 12 pruned. 
[I 2024-07-08 01:50:53,264] Trial 13 pruned. 
[I 2024-07-08 01:52:02,391] Trial 14 pruned. 
[I 2024-07-08 01:53:36,812] Trial 15 pruned. 
[I 2024-07-08 03:58:03,422] Trial 16 finished with value: 0.9474281609195403 and parameters: {'learning_rate': 0.0007238086291181397, 'embedding_dim': 16, 'depth': 2, 'heads': 8, 'attn_dropout': 0.15000000000000002, 'ff_dropout': 0.1, 'use_shared_categ_embed': False, 'batch_size': 256, 'imputer_strategy': 'most_frequent', 'scaler': 'RobustScaler'}. Best is trial 16 with value: 0.9474281609195403.
[I 2024-07-08 04:03:33,701] Trial 17 pruned. 
[I 2024-07-08 04:04:44,886] Trial 18 pruned. 
[I 2024-07-08 04:09:33,709] Trial 19 pruned. 
[I 2024-07-08 04:11:32,618] Trial 20 pruned. 
[I 2024-07-08 04:11:57,314] Trial 21 pruned. 
[I 2024-07-08 04:14:48,273] Trial 22 pruned. 
[I 2024-07-08 04:15:28,998] Trial 23 pruned. 
[I 2024-07-08 04:17:45,667] Trial 24 pruned. 
[I 2024-07-08 04:18:07,902] Trial 25 pruned. 
[I 2024-07-08 07:18:04,205] Trial 26 finished with value: 0.9514224137931035 and parameters: {'learning_rate': 0.00046858406496824267, 'embedding_dim': 16, 'depth': 6, 'heads': 2, 'attn_dropout': 0.45, 'ff_dropout': 0.3, 'use_shared_categ_embed': True, 'batch_size': 256, 'imputer_strategy': 'median', 'scaler': 'RobustScaler'}. Best is trial 26 with value: 0.9514224137931035.
[I 2024-07-08 07:21:03,728] Trial 27 pruned. 
[I 2024-07-08 07:24:03,558] Trial 28 pruned. 
[I 2024-07-08 07:25:09,677] Trial 29 pruned. 
[I 2024-07-08 07:25:34,427] Trial 30 pruned. 
[I 2024-07-08 07:27:03,666] Trial 31 pruned. 
[I 2024-07-08 13:23:38,830] Trial 32 finished with value: 0.9754597701149426 and parameters: {'learning_rate': 0.00027619794488595805, 'embedding_dim': 16, 'depth': 3, 'heads': 4, 'attn_dropout': 0.45, 'ff_dropout': 0.25, 'use_shared_categ_embed': False, 'batch_size': 128, 'imputer_strategy': 'median', 'scaler': 'StandardScaler'}. Best is trial 32 with value: 0.9754597701149426.
[I 2024-07-08 13:24:25,067] Trial 33 pruned. 
[I 2024-07-08 13:25:17,819] Trial 34 pruned. 
[I 2024-07-08 13:26:22,324] Trial 35 pruned. 
[I 2024-07-08 13:27:00,776] Trial 36 pruned. 
[I 2024-07-08 13:29:47,279] Trial 37 pruned. 
[I 2024-07-08 13:30:38,938] Trial 38 pruned. 
[I 2024-07-08 13:34:20,431] Trial 39 pruned. 
[I 2024-07-08 13:34:44,957] Trial 40 pruned. 
[I 2024-07-08 13:36:13,526] Trial 41 pruned. 
[I 2024-07-08 13:37:04,529] Trial 42 pruned. 
[I 2024-07-08 13:37:57,945] Trial 43 pruned. 
[I 2024-07-08 13:38:58,598] Trial 44 pruned. 
[I 2024-07-08 13:39:46,209] Trial 45 pruned. 
[I 2024-07-08 13:40:05,030] Trial 46 pruned. 
[I 2024-07-08 13:40:24,163] Trial 47 pruned. 
[I 2024-07-08 13:42:13,505] Trial 48 pruned. 
[I 2024-07-08 13:53:06,973] Trial 49 pruned. 
[I 2024-07-08 13:56:02,034] Trial 50 pruned. 
[I 2024-07-08 13:57:34,186] Trial 51 pruned. 
[I 2024-07-08 13:57:54,706] Trial 52 pruned. 
[I 2024-07-08 14:00:41,097] Trial 53 pruned. 
[I 2024-07-08 14:01:41,877] Trial 54 pruned. 
[I 2024-07-08 14:02:02,086] Trial 55 pruned. 
[I 2024-07-08 14:05:09,187] Trial 56 pruned. 
[I 2024-07-08 14:05:31,112] Trial 57 pruned. 
[I 2024-07-08 14:06:03,255] Trial 58 pruned. 
[I 2024-07-08 14:08:53,044] Trial 59 pruned. 
