cesga/2020 unloaded
        Preparing the environment for use of the CESGA 2022 software stack.
        Please rebuild modules cache: module --ignore-cache avail
     
cesga/2022 loaded
python/3.10.8 loaded

The following have been reloaded with a version change:
  1) cesga/2020 => cesga/2022

[I 2024-07-11 10:21:05,552] A new study created in memory with name: no-name-fb53ac69-bbab-40b0-83d9-6aed11f5759b
[I 2024-07-11 10:59:40,764] Trial 0 finished with value: 0.953655433922308 and parameters: {'learning_rate': 0.0013292918943162175, 'embedding_dim': 16, 'depth': 4, 'heads': 2, 'attn_dropout': 0.05, 'ff_dropout': 0.05, 'use_shared_categ_embed': True, 'batch_size': 512, 'imputer_strategy': 'mean', 'scaler': 'RobustScaler'}. Best is trial 0 with value: 0.953655433922308.
[I 2024-07-11 11:41:58,737] Trial 1 finished with value: 0.9229364503034724 and parameters: {'learning_rate': 0.0019762189340280074, 'embedding_dim': 32, 'depth': 2, 'heads': 4, 'attn_dropout': 0.15000000000000002, 'ff_dropout': 0.25, 'use_shared_categ_embed': True, 'batch_size': 256, 'imputer_strategy': 'mean', 'scaler': 'MinMaxScaler'}. Best is trial 0 with value: 0.953655433922308.
[I 2024-07-11 13:27:27,900] Trial 2 finished with value: 0.9274119235506874 and parameters: {'learning_rate': 0.0008200518402245837, 'embedding_dim': 32, 'depth': 4, 'heads': 2, 'attn_dropout': 0.25, 'ff_dropout': 0.05, 'use_shared_categ_embed': True, 'batch_size': 128, 'imputer_strategy': 'most_frequent', 'scaler': 'MinMaxScaler'}. Best is trial 0 with value: 0.953655433922308.
[I 2024-07-11 13:46:36,529] Trial 3 finished with value: 0.9268561581226591 and parameters: {'learning_rate': 0.00621870472776908, 'embedding_dim': 16, 'depth': 2, 'heads': 2, 'attn_dropout': 0.15000000000000002, 'ff_dropout': 0.2, 'use_shared_categ_embed': False, 'batch_size': 512, 'imputer_strategy': 'median', 'scaler': 'StandardScaler'}. Best is trial 0 with value: 0.953655433922308.
[I 2024-07-11 15:46:13,975] Trial 4 finished with value: 0.9217294637884196 and parameters: {'learning_rate': 0.00010388823104027947, 'embedding_dim': 16, 'depth': 5, 'heads': 8, 'attn_dropout': 0.05, 'ff_dropout': 0.2, 'use_shared_categ_embed': False, 'batch_size': 128, 'imputer_strategy': 'most_frequent', 'scaler': 'MinMaxScaler'}. Best is trial 0 with value: 0.953655433922308.
[I 2024-07-11 15:46:27,478] Trial 5 pruned. 
[I 2024-07-11 15:52:27,861] Trial 6 pruned. 
[I 2024-07-11 15:52:39,226] Trial 7 pruned. 
[I 2024-07-11 16:00:49,852] Trial 8 pruned. 
[I 2024-07-11 16:01:14,661] Trial 9 pruned. 
[I 2024-07-11 16:08:13,805] Trial 10 pruned. 
[I 2024-07-11 16:08:32,938] Trial 11 pruned. 
[I 2024-07-11 16:08:57,455] Trial 12 pruned. 
[I 2024-07-11 16:09:05,270] Trial 13 pruned. 
[I 2024-07-11 16:09:37,037] Trial 14 pruned. 
[I 2024-07-11 16:10:04,896] Trial 15 pruned. 
[I 2024-07-11 16:48:54,390] Trial 16 finished with value: 0.954552703198897 and parameters: {'learning_rate': 0.0007238086291181397, 'embedding_dim': 16, 'depth': 2, 'heads': 8, 'attn_dropout': 0.15000000000000002, 'ff_dropout': 0.1, 'use_shared_categ_embed': False, 'batch_size': 256, 'imputer_strategy': 'most_frequent', 'scaler': 'RobustScaler'}. Best is trial 16 with value: 0.954552703198897.
[I 2024-07-11 16:59:00,240] Trial 17 pruned. 
[I 2024-07-11 16:59:38,890] Trial 18 pruned. 
[I 2024-07-11 17:00:19,747] Trial 19 pruned. 
[I 2024-07-11 17:00:38,982] Trial 20 pruned. 
[I 2024-07-11 17:00:53,401] Trial 21 pruned. 
[I 2024-07-11 17:01:34,249] Trial 22 pruned. 
[I 2024-07-11 17:31:00,566] Trial 23 finished with value: 0.9113785465947577 and parameters: {'learning_rate': 0.007861612553123303, 'embedding_dim': 16, 'depth': 3, 'heads': 6, 'attn_dropout': 0.35000000000000003, 'ff_dropout': 0.4, 'use_shared_categ_embed': True, 'batch_size': 512, 'imputer_strategy': 'median', 'scaler': 'RobustScaler'}. Best is trial 16 with value: 0.954552703198897.
[I 2024-07-11 17:32:12,164] Trial 24 pruned. 
[I 2024-07-11 17:32:25,664] Trial 25 pruned. 
[I 2024-07-11 17:32:51,118] Trial 26 pruned. 
[I 2024-07-11 17:33:18,584] Trial 27 pruned. 
[I 2024-07-11 17:34:08,630] Trial 28 pruned. 
[I 2024-07-11 17:34:41,480] Trial 29 pruned. 
[I 2024-07-11 17:34:56,745] Trial 30 pruned. 
[I 2024-07-11 17:35:13,476] Trial 31 pruned. 
[I 2024-07-11 17:35:39,316] Trial 32 pruned. 
[I 2024-07-11 17:35:47,361] Trial 33 pruned. 
[I 2024-07-11 17:36:31,850] Trial 34 pruned. 
[I 2024-07-11 17:37:02,886] Trial 35 pruned. 
[I 2024-07-11 17:37:21,075] Trial 36 pruned. 
[I 2024-07-11 17:47:11,627] Trial 37 pruned. 
[I 2024-07-11 17:47:22,879] Trial 38 pruned. 
[I 2024-07-11 20:00:18,697] Trial 39 finished with value: 0.94719320342657 and parameters: {'learning_rate': 0.001022852084545208, 'embedding_dim': 16, 'depth': 6, 'heads': 4, 'attn_dropout': 0.45, 'ff_dropout': 0.15000000000000002, 'use_shared_categ_embed': False, 'batch_size': 128, 'imputer_strategy': 'median', 'scaler': 'StandardScaler'}. Best is trial 16 with value: 0.954552703198897.
[I 2024-07-11 20:00:33,877] Trial 40 pruned. 
[I 2024-07-11 20:51:13,533] Trial 41 finished with value: 0.9434974678291054 and parameters: {'learning_rate': 0.0020768480625669885, 'embedding_dim': 32, 'depth': 3, 'heads': 6, 'attn_dropout': 0.25, 'ff_dropout': 0.15000000000000002, 'use_shared_categ_embed': True, 'batch_size': 256, 'imputer_strategy': 'median', 'scaler': 'RobustScaler'}. Best is trial 16 with value: 0.954552703198897.
[I 2024-07-11 20:51:53,053] Trial 42 pruned. 
[I 2024-07-11 20:52:08,978] Trial 43 pruned. 
[I 2024-07-11 21:41:43,456] Trial 44 finished with value: 0.9444375177782216 and parameters: {'learning_rate': 0.0032935634665172673, 'embedding_dim': 16, 'depth': 6, 'heads': 8, 'attn_dropout': 0.25, 'ff_dropout': 0.35000000000000003, 'use_shared_categ_embed': True, 'batch_size': 512, 'imputer_strategy': 'most_frequent', 'scaler': 'StandardScaler'}. Best is trial 16 with value: 0.954552703198897.
[I 2024-07-11 21:42:09,184] Trial 45 pruned. 
[I 2024-07-11 21:42:19,498] Trial 46 pruned. 
[I 2024-07-11 21:42:29,921] Trial 47 pruned. 
[I 2024-07-11 22:42:02,828] Trial 48 finished with value: 0.9389576855341298 and parameters: {'learning_rate': 0.0015932692803157353, 'embedding_dim': 16, 'depth': 2, 'heads': 8, 'attn_dropout': 0.45, 'ff_dropout': 0.2, 'use_shared_categ_embed': False, 'batch_size': 128, 'imputer_strategy': 'mean', 'scaler': 'RobustScaler'}. Best is trial 16 with value: 0.954552703198897.
[I 2024-07-11 22:42:27,174] Trial 49 pruned. 
[I 2024-07-11 22:42:48,073] Trial 50 pruned. 
[I 2024-07-11 22:43:10,347] Trial 51 pruned. 
[I 2024-07-11 22:43:21,741] Trial 52 pruned. 
[I 2024-07-11 22:45:47,400] Trial 53 pruned. 
[I 2024-07-11 22:46:14,525] Trial 54 pruned. 
[I 2024-07-11 22:46:25,819] Trial 55 pruned. 
[I 2024-07-11 22:46:52,485] Trial 56 pruned. 
[I 2024-07-11 22:47:06,534] Trial 57 pruned. 
[I 2024-07-11 22:47:19,091] Trial 58 pruned. 
[I 2024-07-11 22:48:01,389] Trial 59 pruned. 
