cesga/2020 unloaded
        Preparing the environment for use of the CESGA 2022 software stack.
        Please rebuild modules cache: module --ignore-cache avail
     
cesga/2022 loaded
python/3.10.8 loaded

The following have been reloaded with a version change:
  1) cesga/2020 => cesga/2022

[I 2024-07-12 11:18:51,328] A new study created in memory with name: no-name-8deeddbc-2659-47a2-8888-211bcc8e9975
[I 2024-07-12 11:29:34,451] Trial 0 finished with value: 0.9281342547249313 and parameters: {'learning_rate': 0.0013292918943162175, 'embedding_dim': 16, 'depth': 4, 'heads': 2, 'attn_dropout': 0.05, 'ff_dropout': 0.05, 'use_shared_categ_embed': True, 'batch_size': 512, 'imputer_strategy': 'mean', 'scaler': 'RobustScaler'}. Best is trial 0 with value: 0.9281342547249313.
[I 2024-07-12 12:07:08,575] Trial 1 finished with value: 0.9202971909626261 and parameters: {'learning_rate': 0.0019762189340280074, 'embedding_dim': 32, 'depth': 2, 'heads': 4, 'attn_dropout': 0.15000000000000002, 'ff_dropout': 0.25, 'use_shared_categ_embed': True, 'batch_size': 256, 'imputer_strategy': 'mean', 'scaler': 'MinMaxScaler'}. Best is trial 0 with value: 0.9281342547249313.
[I 2024-07-12 13:16:45,871] Trial 2 finished with value: 0.9295816000889982 and parameters: {'learning_rate': 0.0008200518402245837, 'embedding_dim': 32, 'depth': 4, 'heads': 2, 'attn_dropout': 0.25, 'ff_dropout': 0.05, 'use_shared_categ_embed': True, 'batch_size': 128, 'imputer_strategy': 'most_frequent', 'scaler': 'MinMaxScaler'}. Best is trial 2 with value: 0.9295816000889982.
[I 2024-07-12 13:24:23,808] Trial 3 finished with value: 0.9228286183997655 and parameters: {'learning_rate': 0.00621870472776908, 'embedding_dim': 16, 'depth': 2, 'heads': 2, 'attn_dropout': 0.15000000000000002, 'ff_dropout': 0.2, 'use_shared_categ_embed': False, 'batch_size': 512, 'imputer_strategy': 'median', 'scaler': 'StandardScaler'}. Best is trial 2 with value: 0.9295816000889982.
[I 2024-07-12 14:09:03,342] Trial 4 finished with value: 0.9315103638377066 and parameters: {'learning_rate': 0.00010388823104027947, 'embedding_dim': 16, 'depth': 5, 'heads': 8, 'attn_dropout': 0.05, 'ff_dropout': 0.2, 'use_shared_categ_embed': False, 'batch_size': 128, 'imputer_strategy': 'most_frequent', 'scaler': 'MinMaxScaler'}. Best is trial 4 with value: 0.9315103638377066.
[I 2024-07-12 14:09:12,257] Trial 5 pruned. 
[I 2024-07-12 14:42:51,051] Trial 6 finished with value: 0.9261456863211303 and parameters: {'learning_rate': 0.000485729517921717, 'embedding_dim': 32, 'depth': 2, 'heads': 8, 'attn_dropout': 0.45, 'ff_dropout': 0.35000000000000003, 'use_shared_categ_embed': True, 'batch_size': 256, 'imputer_strategy': 'median', 'scaler': 'RobustScaler'}. Best is trial 4 with value: 0.9315103638377066.
[I 2024-07-12 14:42:55,321] Trial 7 pruned. 
[I 2024-07-12 14:43:09,509] Trial 8 pruned. 
[I 2024-07-12 14:43:17,788] Trial 9 pruned. 
[I 2024-07-12 14:43:26,869] Trial 10 pruned. 
[I 2024-07-12 14:43:35,914] Trial 11 pruned. 
[I 2024-07-12 14:43:44,728] Trial 12 pruned. 
[I 2024-07-12 14:43:48,281] Trial 13 pruned. 
[I 2024-07-12 14:44:01,120] Trial 14 pruned. 
[I 2024-07-12 14:44:17,337] Trial 15 pruned. 
[I 2024-07-12 14:44:22,914] Trial 16 pruned. 
[I 2024-07-12 14:44:46,345] Trial 17 pruned. 
[I 2024-07-12 14:45:00,521] Trial 18 pruned. 
[I 2024-07-12 14:45:40,586] Trial 19 pruned. 
[I 2024-07-12 14:45:47,757] Trial 20 pruned. 
[I 2024-07-12 14:45:52,852] Trial 21 pruned. 
[I 2024-07-12 14:46:17,379] Trial 22 pruned. 
[I 2024-07-12 14:46:21,426] Trial 23 pruned. 
[I 2024-07-12 15:21:32,105] Trial 24 finished with value: 0.3857335540834036 and parameters: {'learning_rate': 0.007155734029264282, 'embedding_dim': 16, 'depth': 5, 'heads': 2, 'attn_dropout': 0.45, 'ff_dropout': 0.4, 'use_shared_categ_embed': False, 'batch_size': 128, 'imputer_strategy': 'most_frequent', 'scaler': 'StandardScaler'}. Best is trial 4 with value: 0.9315103638377066.
[I 2024-07-12 15:21:37,249] Trial 25 pruned. 
[I 2024-07-12 15:21:45,735] Trial 26 pruned. 
[I 2024-07-12 15:22:01,541] Trial 27 pruned. 
[I 2024-07-12 15:22:29,211] Trial 28 pruned. 
[I 2024-07-12 15:22:42,117] Trial 29 pruned. 
[I 2024-07-12 15:22:47,378] Trial 30 pruned. 
[I 2024-07-12 15:23:00,929] Trial 31 pruned. 
[I 2024-07-12 15:59:14,270] Trial 32 finished with value: 0.9295810547577965 and parameters: {'learning_rate': 0.00027619794488595805, 'embedding_dim': 16, 'depth': 3, 'heads': 4, 'attn_dropout': 0.45, 'ff_dropout': 0.25, 'use_shared_categ_embed': False, 'batch_size': 128, 'imputer_strategy': 'median', 'scaler': 'StandardScaler'}. Best is trial 4 with value: 0.9315103638377066.
[I 2024-07-12 15:59:22,156] Trial 33 pruned. 
[I 2024-07-12 15:59:30,911] Trial 34 pruned. 
[I 2024-07-12 16:31:41,567] Trial 35 finished with value: 0.49965644134308523 and parameters: {'learning_rate': 0.013805392471755754, 'embedding_dim': 16, 'depth': 4, 'heads': 2, 'attn_dropout': 0.25, 'ff_dropout': 0.3, 'use_shared_categ_embed': False, 'batch_size': 128, 'imputer_strategy': 'median', 'scaler': 'StandardScaler'}. Best is trial 4 with value: 0.9315103638377066.
[I 2024-07-12 16:31:48,721] Trial 36 pruned. 
[I 2024-07-12 17:32:43,349] Trial 37 finished with value: 0.9280743410035983 and parameters: {'learning_rate': 0.0005468562564708453, 'embedding_dim': 32, 'depth': 3, 'heads': 2, 'attn_dropout': 0.45, 'ff_dropout': 0.05, 'use_shared_categ_embed': True, 'batch_size': 128, 'imputer_strategy': 'mean', 'scaler': 'RobustScaler'}. Best is trial 4 with value: 0.9315103638377066.
[I 2024-07-12 17:32:51,839] Trial 38 pruned. 
[I 2024-07-12 18:16:51,087] Trial 39 finished with value: 0.9174588147698955 and parameters: {'learning_rate': 0.001022852084545208, 'embedding_dim': 16, 'depth': 6, 'heads': 4, 'attn_dropout': 0.45, 'ff_dropout': 0.15000000000000002, 'use_shared_categ_embed': False, 'batch_size': 128, 'imputer_strategy': 'median', 'scaler': 'StandardScaler'}. Best is trial 4 with value: 0.9315103638377066.
[I 2024-07-12 18:16:56,201] Trial 40 pruned. 
[I 2024-07-12 18:17:09,828] Trial 41 pruned. 
[I 2024-07-12 18:17:18,337] Trial 42 pruned. 
[I 2024-07-12 18:17:27,517] Trial 43 pruned. 
[I 2024-07-12 18:17:33,811] Trial 44 pruned. 
[I 2024-07-12 18:17:42,792] Trial 45 pruned. 
[I 2024-07-12 18:17:46,890] Trial 46 pruned. 
[I 2024-07-12 18:17:51,007] Trial 47 pruned. 
[I 2024-07-12 18:45:21,960] Trial 48 finished with value: 0.9258435364801125 and parameters: {'learning_rate': 0.0015932692803157353, 'embedding_dim': 16, 'depth': 2, 'heads': 8, 'attn_dropout': 0.45, 'ff_dropout': 0.2, 'use_shared_categ_embed': False, 'batch_size': 128, 'imputer_strategy': 'mean', 'scaler': 'RobustScaler'}. Best is trial 4 with value: 0.9315103638377066.
[I 2024-07-12 18:45:44,601] Trial 49 pruned. 
[I 2024-07-12 18:45:59,034] Trial 50 pruned. 
[I 2024-07-12 18:46:13,814] Trial 51 pruned. 
[I 2024-07-12 18:46:18,162] Trial 52 pruned. 
[I 2024-07-12 18:48:45,769] Trial 53 pruned. 
[I 2024-07-12 18:48:56,564] Trial 54 pruned. 
[I 2024-07-12 18:49:00,834] Trial 55 pruned. 
[I 2024-07-12 18:49:18,029] Trial 56 pruned. 
[I 2024-07-12 18:49:22,992] Trial 57 pruned. 
[I 2024-07-12 18:49:28,428] Trial 58 pruned. 
[I 2024-07-12 18:49:52,850] Trial 59 pruned. 
